<?xml version="1.0" encoding="UTF-8"?>
<!--
To change this license header, choose License Headers in Project Properties.
To change this template file, choose Tools | Templates
and open the template in the editor.
-->
<root
    xmlns:xsi='http://www.w3.org/2001/XMLSchema-instance'
    xsi:noNamespaceSchemaLocation='countryDetails.xsd'>
    <country code="IN">
        <name>INDIA</name>
        <language>HINDI</language>
        <capital>DELHI</capital>
        <states>
            <state>
                <name>KERALA</name>
                <language>MALAYALAM</language>
                <capital>THIRUVANANTHAPURAM</capital>
            </state>
            
            <state>
                <name>KERALA</name>
                <language>MALAYALAM</language>
                <capital>THIRUVANANTHAPURAM</capital>
            </state>
        </states>
    </country>
</root>
